{
  "schemaVersion": "1.0",
  "id": "identify-image",
  "kind": "short-answer",
  "title": "Nhận diện hình ảnh",
  "prompt": {
    "blocks": [
      {
        "type": "paragraph",
        "children": [
          {
            "type": "text",
            "value": "Trong câu “Mặt trời xuống biển như hòn lửa”, sự vật nào được dùng để so sánh với mặt trời?"
          }
        ]
      }
    ]
  },
  "config": {
    "acceptedAnswers": ["hòn lửa", "hon lua"],
    "normalization": {
      "trim": true,
      "caseSensitive": false,
      "collapseWhitespace": true,
      "removePunctuation": true,
      "unicodeForm": "NFC"
    },
    "maximumLength": 80
  },
  "evaluation": {
    "mode": "automatic",
    "points": 1
  },
  "completion": {
    "required": true
  },
  "feedback": {
    "showExplanation": true
  }
}
