{
  "schemaVersion": "1.0",
  "id": "equation-truth",
  "kind": "true-false",
  "title": "Kiểm tra mệnh đề",
  "prompt": {
    "blocks": [
      {
        "type": "paragraph",
        "children": [
          {
            "type": "text",
            "value": "Mệnh đề x = 4 thỏa mãn 2x + 3 = 11."
          }
        ]
      }
    ]
  },
  "config": {
    "expected": true,
    "explanation": "2 × 4 + 3 = 11."
  },
  "evaluation": {
    "mode": "automatic",
    "points": 1
  },
  "completion": {
    "required": true
  },
  "feedback": {
    "showExplanation": true
  }
}
