{
  "schemaVersion": "1.0",
  "title": "Example activity",
  "prompt": {
    "blocks": [
      {
        "type": "paragraph",
        "children": [
          {
            "type": "text",
            "value": "Answer the prompt."
          }
        ]
      }
    ]
  },
  "evaluation": {
    "mode": "automatic",
    "points": 1
  },
  "completion": {
    "required": true
  },
  "id": "multiple-choice-example",
  "kind": "multiple-choice",
  "config": {
    "options": [
      {
        "id": "a",
        "label": "A"
      },
      {
        "id": "b",
        "label": "B"
      }
    ],
    "correctOptionIds": ["a"],
    "evaluationMode": "exact-set"
  }
}
