{
  "schemaVersion": "1.0",
  "title": "Example activity",
  "prompt": {
    "blocks": [
      {
        "type": "paragraph",
        "children": [
          {
            "type": "text",
            "value": "Answer the prompt."
          }
        ]
      }
    ]
  },
  "evaluation": {
    "mode": "automatic",
    "points": 1
  },
  "completion": {
    "required": true
  },
  "id": "numeric-example",
  "kind": "numeric",
  "config": {
    "answerMode": "number",
    "expected": "42",
    "absoluteTolerance": 0
  }
}
