{
  "schemaVersion": "1.0",
  "title": "Example activity",
  "prompt": {
    "blocks": [
      {
        "type": "paragraph",
        "children": [
          {
            "type": "text",
            "value": "Answer the prompt."
          }
        ]
      }
    ]
  },
  "evaluation": {
    "mode": "automatic",
    "points": 1
  },
  "completion": {
    "required": true
  },
  "id": "fill-blanks-example",
  "kind": "fill-blanks",
  "config": {
    "blanks": [
      {
        "id": "blank-1",
        "label": "Blank 1",
        "acceptedAnswers": ["answer"]
      }
    ],
    "scoring": "all-or-nothing"
  }
}
