{
  "schemaVersion": "1.0",
  "title": "Example activity",
  "prompt": {
    "blocks": [
      {
        "type": "paragraph",
        "children": [
          {
            "type": "text",
            "value": "Answer the prompt."
          }
        ]
      }
    ]
  },
  "evaluation": {
    "mode": "automatic",
    "points": 1
  },
  "completion": {
    "required": true
  },
  "id": "unsafe-noncoding",
  "kind": "single-choice",
  "config": {
    "runtime": {
      "kind": "local"
    },
    "options": [
      {
        "id": "a",
        "label": "A"
      },
      {
        "id": "b",
        "label": "B"
      }
    ],
    "correctOptionId": "a"
  }
}
